{
  "certificate": {
    "eligible_mutations": [
      "e00024"
    ],
    "excluded_after_cutoff": [
      "e00029",
      "e00031"
    ],
    "ignored_recalls": [
      "e00032"
    ],
    "selected_event": "e00024",
    "selection_rule": "maximum_eligible_revision"
  },
  "events": [
    {
      "entity": "Ecfa2aeb45643_768c",
      "id": "e00001",
      "key": "Kcfa2aeb45643_75eb",
      "label": "Lcfa2aeb45643_3",
      "op": "WRITE",
      "position": 1,
      "ref": null,
      "revision": 1,
      "supersedes": null,
      "value": "Vcfa2aeb45643_e31fe"
    },
    {
      "entity": "Ecfa2aeb45643_768c",
      "id": "e00002",
      "key": "Kcfa2aeb45643_75eb",
      "label": "Lcfa2aeb45643_3",
      "op": "WRITE",
      "position": 2,
      "ref": null,
      "revision": 2,
      "supersedes": "e00001",
      "value": "Vcfa2aeb45643_8b330"
    },
    {
      "entity": "Ecfa2aeb45643_768c",
      "id": "e00003",
      "key": "Kcfa2aeb45643_75eb",
      "label": "Lcfa2aeb45643_3",
      "op": "WRITE",
      "position": 3,
      "ref": null,
      "revision": 3,
      "supersedes": "e00002",
      "value": "Vcfa2aeb45643_9b51e"
    },
    {
      "entity": "Ecfa2aeb45643_768d",
      "id": "e00004",
      "key": "Kcfa2aeb45643_75eb",
      "label": "Lcfa2aeb45643_3",
      "op": "WRITE",
      "position": 4,
      "ref": null,
      "revision": 1,
      "supersedes": null,
      "value": "Vcfa2aeb45643_8b330"
    },
    {
      "entity": "Ecfa2aeb45643_768a",
      "id": "e00005",
      "key": "Kcfa2aeb45643_75eb",
      "label": "Lcfa2aeb45643_3",
      "op": "WRITE",
      "position": 5,
      "ref": null,
      "revision": 1,
      "supersedes": null,
      "value": "Vcfa2aeb45643_c8a67"
    },
    {
      "entity": "Ecfa2aeb45643_768d",
      "id": "e00006",
      "key": "Kcfa2aeb45643_75eb",
      "label": "Lcfa2aeb45643_3",
      "op": "WRITE",
      "position": 6,
      "ref": null,
      "revision": 2,
      "supersedes": "e00004",
      "value": "Vcfa2aeb45643_3d253"
    },
    {
      "entity": "Ecfa2aeb45643_768c",
      "id": "e00007",
      "key": "Kcfa2aeb45643_75eb",
      "label": "Lcfa2aeb45643_3",
      "op": "WRITE",
      "position": 7,
      "ref": null,
      "revision": 4,
      "supersedes": "e00003",
      "value": "Vcfa2aeb45643_4fdff"
    },
    {
      "entity": "Ecfa2aeb45643_768e",
      "id": "e00008",
      "key": "Kcfa2aeb45643_75eb",
      "label": "Lcfa2aeb45643_3",
      "op": "WRITE",
      "position": 8,
      "ref": null,
      "revision": 1,
      "supersedes": null,
      "value": "Vcfa2aeb45643_8b330"
    },
    {
      "entity": "Ecfa2aeb45643_768e",
      "id": "e00009",
      "key": "Kcfa2aeb45643_75eb",
      "label": "Lcfa2aeb45643_3",
      "op": "WRITE",
      "position": 9,
      "ref": null,
      "revision": 2,
      "supersedes": "e00008",
      "value": "Vcfa2aeb45643_61352"
    },
    {
      "entity": "Ecfa2aeb45643_768e",
      "id": "e00010",
      "key": "Kcfa2aeb45643_75eb",
      "label": "Lcfa2aeb45643_3",
      "op": "WRITE",
      "position": 10,
      "ref": null,
      "revision": 3,
      "supersedes": "e00009",
      "value": "Vcfa2aeb45643_99bb0"
    },
    {
      "entity": "Ecfa2aeb45643_768e",
      "id": "e00011",
      "key": "Kcfa2aeb45643_75eb",
      "label": "Lcfa2aeb45643_3",
      "op": "WRITE",
      "position": 11,
      "ref": null,
      "revision": 4,
      "supersedes": "e00010",
      "value": "Vcfa2aeb45643_61352"
    },
    {
      "entity": "Ecfa2aeb45643_768c",
      "id": "e00012",
      "key": "Kcfa2aeb45643_75eb",
      "label": "Lcfa2aeb45643_3",
      "op": "WRITE",
      "position": 12,
      "ref": null,
      "revision": 5,
      "supersedes": "e00007",
      "value": "Vcfa2aeb45643_e6894"
    },
    {
      "entity": "Ecfa2aeb45643_768d",
      "id": "e00013",
      "key": "Kcfa2aeb45643_75eb",
      "label": "Lcfa2aeb45643_3",
      "op": "WRITE",
      "position": 13,
      "ref": null,
      "revision": 3,
      "supersedes": "e00006",
      "value": "Vcfa2aeb45643_e41fb"
    },
    {
      "entity": "Ecfa2aeb45643_768e",
      "id": "e00014",
      "key": "Kcfa2aeb45643_75eb",
      "label": "Lcfa2aeb45643_3",
      "op": "WRITE",
      "position": 14,
      "ref": null,
      "revision": 5,
      "supersedes": "e00011",
      "value": "Vcfa2aeb45643_a0753"
    },
    {
      "entity": "Ecfa2aeb45643_768a",
      "id": "e00015",
      "key": "Kcfa2aeb45643_75eb",
      "label": "Lcfa2aeb45643_3",
      "op": "WRITE",
      "position": 15,
      "ref": null,
      "revision": 2,
      "supersedes": "e00005",
      "value": "Vcfa2aeb45643_9b51e"
    },
    {
      "entity": "Ecfa2aeb45643_768c",
      "id": "e00016",
      "key": "Kcfa2aeb45643_75eb",
      "label": "Lcfa2aeb45643_3",
      "op": "WRITE",
      "position": 16,
      "ref": null,
      "revision": 6,
      "supersedes": "e00012",
      "value": "Vcfa2aeb45643_3ac97"
    },
    {
      "entity": "Ecfa2aeb45643_768c",
      "id": "e00017",
      "key": "Kcfa2aeb45643_75eb",
      "label": "Lcfa2aeb45643_3",
      "op": "WRITE",
      "position": 17,
      "ref": null,
      "revision": 7,
      "supersedes": "e00016",
      "value": "Vcfa2aeb45643_e3ee0"
    },
    {
      "entity": "Ecfa2aeb45643_768a",
      "id": "e00018",
      "key": "Kcfa2aeb45643_75eb",
      "label": "Lcfa2aeb45643_3",
      "op": "WRITE",
      "position": 18,
      "ref": null,
      "revision": 3,
      "supersedes": "e00015",
      "value": "Vcfa2aeb45643_0c846"
    },
    {
      "entity": "Ecfa2aeb45643_768c",
      "id": "e00019",
      "key": "Kcfa2aeb45643_75eb",
      "label": "Lcfa2aeb45643_3",
      "op": "WRITE",
      "position": 19,
      "ref": null,
      "revision": 8,
      "supersedes": "e00017",
      "value": "Vcfa2aeb45643_99bb0"
    },
    {
      "entity": "Ecfa2aeb45643_768e",
      "id": "e00020",
      "key": "Kcfa2aeb45643_75eb",
      "label": "Lcfa2aeb45643_3",
      "op": "WRITE",
      "position": 20,
      "ref": null,
      "revision": 6,
      "supersedes": "e00014",
      "value": "Vcfa2aeb45643_35a46"
    },
    {
      "entity": "Ecfa2aeb45643_768d",
      "id": "e00021",
      "key": "Kcfa2aeb45643_75eb",
      "label": "Lcfa2aeb45643_3",
      "op": "WRITE",
      "position": 21,
      "ref": null,
      "revision": 4,
      "supersedes": "e00013",
      "value": "Vcfa2aeb45643_b9a32"
    },
    {
      "entity": "Ecfa2aeb45643_768a",
      "id": "e00022",
      "key": "Kcfa2aeb45643_75eb",
      "label": "Lcfa2aeb45643_3",
      "op": "WRITE",
      "position": 22,
      "ref": null,
      "revision": 4,
      "supersedes": "e00018",
      "value": "Vcfa2aeb45643_35a46"
    },
    {
      "entity": "Ecfa2aeb45643_768c",
      "id": "e00023",
      "key": "Kcfa2aeb45643_75eb",
      "label": "Lcfa2aeb45643_3",
      "op": "WRITE",
      "position": 23,
      "ref": null,
      "revision": 9,
      "supersedes": "e00019",
      "value": "Vcfa2aeb45643_4fdff"
    },
    {
      "entity": "Ecfa2aeb45643_768b",
      "id": "e00024",
      "key": "Kcfa2aeb45643_75eb",
      "label": "Lcfa2aeb45643_3",
      "op": "WRITE",
      "position": 24,
      "ref": null,
      "revision": 1,
      "supersedes": null,
      "value": "Vcfa2aeb45643_a73e3"
    },
    {
      "entity": "Ecfa2aeb45643_768c",
      "id": "e00025",
      "key": "Kcfa2aeb45643_75eb",
      "label": "Lcfa2aeb45643_3",
      "op": "WRITE",
      "position": 25,
      "ref": null,
      "revision": 10,
      "supersedes": "e00023",
      "value": "Vcfa2aeb45643_dcd3b"
    },
    {
      "entity": "Ecfa2aeb45643_768a",
      "id": "e00026",
      "key": "Kcfa2aeb45643_75eb",
      "label": "Lcfa2aeb45643_3",
      "op": "WRITE",
      "position": 26,
      "ref": null,
      "revision": 5,
      "supersedes": "e00022",
      "value": "Vcfa2aeb45643_dcd3b"
    },
    {
      "entity": "Ecfa2aeb45643_768d",
      "id": "e00027",
      "key": "Kcfa2aeb45643_75eb",
      "label": "Lcfa2aeb45643_3",
      "op": "WRITE",
      "position": 27,
      "ref": null,
      "revision": 5,
      "supersedes": "e00021",
      "value": "Vcfa2aeb45643_b9a32"
    },
    {
      "entity": "Ecfa2aeb45643_768d",
      "id": "e00028",
      "key": "Kcfa2aeb45643_75eb",
      "label": "Lcfa2aeb45643_3",
      "op": "WRITE",
      "position": 28,
      "ref": null,
      "revision": 6,
      "supersedes": "e00027",
      "value": "Vcfa2aeb45643_3d253"
    },
    {
      "entity": "Ecfa2aeb45643_768b",
      "id": "e00029",
      "key": "Kcfa2aeb45643_75eb",
      "label": "Lcfa2aeb45643_3",
      "op": "WRITE",
      "position": 29,
      "ref": null,
      "revision": 2,
      "supersedes": "e00024",
      "value": "Vcfa2aeb45643_9b51e"
    },
    {
      "entity": "Ecfa2aeb45643_768e",
      "id": "e00030",
      "key": "Kcfa2aeb45643_75eb",
      "label": "Lcfa2aeb45643_3",
      "op": "WRITE",
      "position": 30,
      "ref": null,
      "revision": 7,
      "supersedes": "e00020",
      "value": "Vcfa2aeb45643_dcd3b"
    },
    {
      "entity": "Ecfa2aeb45643_768b",
      "id": "e00031",
      "key": "Kcfa2aeb45643_75eb",
      "label": "Lcfa2aeb45643_3",
      "op": "WRITE",
      "position": 31,
      "ref": null,
      "revision": 3,
      "supersedes": "e00029",
      "value": "Vcfa2aeb45643_fd6b3"
    },
    {
      "entity": "Ecfa2aeb45643_768b",
      "id": "e00032",
      "key": "Kcfa2aeb45643_75eb",
      "label": "Lcfa2aeb45643_3",
      "op": "RECALL",
      "position": 32,
      "ref": "e00029",
      "revision": null,
      "supersedes": null,
      "value": "Vcfa2aeb45643_9b51e"
    }
  ],
  "evidence": {
    "answer_span": [
      4654,
      4673
    ],
    "answer_text": "Vcfa2aeb45643_a73e3",
    "event_id": "e00024",
    "event_span": [
      4521,
      4673
    ]
  },
  "factors": {
    "answer_delay": 8,
    "cutoff_gap": 3,
    "event_count": 32,
    "expected_status": "present",
    "interference": "near_identity",
    "mode": "as_of",
    "recall": true,